{
  "$schema": "https://json-schema.org/draft/2020-12/schema",
  "$id": "https://runcriticon.com/schemas/auditoria/acceso-datos-sensibles-v1.json",
  "title": "AccesoADatosSensibles",
  "description": "Acceso efectivo (Either.Right) a datos sensibles de un tercero (ADR-0009 D15) — @AuditaAcceso. `aggregateId` es siempre el sujeto cuyos datos se leyeron o modificaron.",
  "type": "object",
  "required": ["eventId", "aggregateId", "occurredAt", "version", "clubId", "recurso", "sujetoId"],
  "properties": {
    "eventId": { "type": "string", "format": "uuid" },
    "aggregateId": { "type": "string", "format": "uuid" },
    "occurredAt": { "type": "string", "format": "date-time" },
    "version": { "type": "integer", "minimum": 1 },
    "clubId": { "type": "string", "format": "uuid" },
    "actorId": { "type": ["string", "null"], "format": "uuid" },
    "traceparent": { "type": ["string", "null"] },
    "recurso": { "type": "string", "description": "Qué se leyó/modificó, ej. alumno_perfil, marca" },
    "sujetoId": { "type": "string", "format": "uuid" }
  },
  "additionalProperties": false
}
